id,title,price,link,img_url
6218885,Karaca Home Melosa Pembe %100 Pamuk Çift Kişilik Nevresim Takımı,1299,https://www.karaca.com/urun/karaca-home-melosa-pembe-100-pamuk-cift-kisilik-nevresim-takimi,https://cdn.karaca.com/rcman/cw250h250q90gm/image/banner/karaca/urun/urun2/urun3/200.18.01.0281-11.jpg
7131147,Karaca Home Joena Bej Çift Kişilik Battaniye,424.99,https://www.karaca.com/urun/karaca-home-joena-bej-cift-kisilik-battaniye,https://cdn.karaca.com/rcman/cw250h250q90gm/image/banner/karaca/urun/200.21.01.0126-200.21.01.0132-kh_joena_bej_cift_ks_battaniye_pp_3.jpg
7175189,Karaca Home Raya Çift Kişilik Pamuk Battaniye Kiremit,399.99,https://www.karaca.com/urun/karaca-home-raya-cift-kisilik-pamuk-battaniye-kremit,https://cdn.karaca.com/rcman/cw250h250q90gm/image/cdndata/1/202306/200.22.04.0212/8680214331514-120.jpg
7166059,Karaca Home Tuğba 8 Parça Private Çeyiz Seti Gold,2999,https://www.karaca.com/urun/karaca-home-tugba-8-parca-private-ceyiz-seti-gold,https://cdn.karaca.com/rcman/cw250h250q90gm/image/cdndata/1/202212/200.22.11.0041/8680214322864-235.jpg
4005791,Karaca Home Neos Mavi %100 Pamuk Çift Kişilik Nevresim Takımı,799.99,https://www.karaca.com/urun/karaca-home-neos-mavi-rnf-cift-kisilik-nevresim-takimi,https://cdn.karaca.com/rcman/cw250h250q90gm/image/cdndata/1/201912/200.15.01.0272/8680214224335-1322.jpg
5857762,Karaca Home Clarinda Hardal %100 Pamuk Çift Kişilik Lastik Çarşaflı Nevresim Takımı,799.99,https://www.karaca.com/urun/karaca-home-clarinda-indigo-cift-kisilik-nevresim-takimi,https://cdn.karaca.com/rcman/cw250h250q90gm/image/cdndata/1/202010/201.17.01.0067/8680214239582-12.jpg
7014448,Karaca Home Amar Mavi %100 Pamuk Çift Kişilik Nevresim Takımı,799.99,https://www.karaca.com/urun/karaca-home-amar-mavi-100-pamuk-cift-kisilik-nevresim-takimi,https://cdn.karaca.com/rcman/cw250h250q90gm/image/banner/karaca/urun/urun2/urun3/200.20.01.0234-225.jpg
6701878,Sarah Anderson Bahiti %100 Pamuk Çift Kişilik Pike Hediyeli Nevresim Takımı,699.99,https://www.karaca.com/urun/sarah-anderson-bahiti-cift-kisilik-pike-hediyeli-nevresim-takimi,https://cdn.karaca.com/rcman/cw250h250q90gm/image/cdndata/713/202109/160.02.01.0523/8697918858063-1322.jpg
7161867,Karaca Home Roller Çift Kişilik Yatak Örtüsü Bej,199.99,https://www.karaca.com/urun/karaca-home-roller-cift-kisilik-yatak-ortusu-bej,https://cdn.karaca.com/rcman/cw250h250q90gm/image/cdndata/1/202211/200.22.14.0069/8680214321416-12.jpg
7160468,Karaca Home Anna Çift Kişilik Müslin Summer Comfort Pudra,1999,https://www.karaca.com/urun/karaca-home-anna-cift-kisilik-summer-comfort-pudra,https://cdn.karaca.com/rcman/cw250h250q90gm/image/cdndata/1/202211/200.22.04.0030/8680214319703-121.jpg
6183708,Karaca Home Sonya Yeşil %100 Pamuk Çift Kişilik Nevresim Takımı,1299,https://www.karaca.com/urun/karaca-home-sonya-yesil-pamuk-cift-kisilik-nevresim-takimi,https://cdn.karaca.com/rcman/cw250h250q90gm/image/cdndata/1/202104/200.17.01.0308/8680214241790-222.jpg
7135707,Karaca Home Fiona Haki Welsoft Tv Battaniyesi,249.99,https://www.karaca.com/urun/karaca-home-fiona-haki-welsoft-tv-battaniyesi,https://cdn.karaca.com/rcman/cw250h250q90gm/image/banner/200.21.01.0275-3.jpg
7130703,Karaca Home Motto Cotton Comfort Çift Kişilik Uyku Seti İndigo,3499,https://www.karaca.com/urun/karaca-home-motto-indigo-cift-kisilik-cotton-comfort,https://static.karaca.com/catalog/view/assets/images/placeholder-2.jpg
7085592,Karaca Home Marilla %100 Pamuk Çift Kişilik Nevresim Takımı ,699.99,https://www.karaca.com/urun/karaca-home-marilla--100-pamuk-cift-kisilik-nevresim-takimi,https://static.karaca.com/catalog/view/assets/images/placeholder-2.jpg
6706102,Karaca Home Woodland Lacivert Tek Kişilik Cozy Comfort Uyku Seti,1699,https://www.karaca.com/urun/karaca-home-woodland-lacivert-tek-kisilik-cozy-comfort-set,https://static.karaca.com/catalog/view/assets/images/placeholder-2.jpg
7175624,Karaca Home Sofie Tek Kişilik Pike Kırmızı,349.99,https://www.karaca.com/urun/karaca-home-sofie-tek-kisilik-pike-kirmizi,https://static.karaca.com/catalog/view/assets/images/placeholder-2.jpg
7176496,Karaca Home Lorrie Çift Kişililik Baskılı Teddy Comfort Set Gri,2499,https://www.karaca.com/urun/karaca-home-lorrie-cift-kisililik-teddy-comfort-set-gri,https://static.karaca.com/catalog/view/assets/images/placeholder-2.jpg
7171374,Karaca Home Evergreen Çift Kişilik Nevresim Takımı Yeşil,1299,https://www.karaca.com/urun/karaca-home-evergreen-cift-kisilik-nevresim-takimi-yesil,https://static.karaca.com/catalog/view/assets/images/placeholder-2.jpg
7191335,Karaca Home Scarlett 8 Parça Ceyiz Seti Gri ,2999,https://www.karaca.com/urun/karaca-home-scarlett-8-parca-ceyiz-seti-gri,https://static.karaca.com/catalog/view/assets/images/placeholder-2.jpg
7176693,Karaca Home x 2Wins Initial Çift Kişilik Yatak Örtüsü,3999,https://www.karaca.com/urun/karaca-home-x-2-wins-initial-cift-kisilik-yatak-ortusu,https://static.karaca.com/catalog/view/assets/images/placeholder-2.jpg
7175627,Karaca Home Sofie Tek Kişilik Pike Bej,349.99,https://www.karaca.com/urun/karaca-home-sofie-tek-kisilik-pike-bej,https://static.karaca.com/catalog/view/assets/images/placeholder-2.jpg
7131163,Karaca Home Joena Antrasit Çift Kişilik Battaniye,424.99,https://www.karaca.com/urun/karaca-home-joena-antrasit-cift-kisilik-battaniye,https://static.karaca.com/catalog/view/assets/images/placeholder-2.jpg
7160472,Karaca Home Anna Çift Kişilik Müslin Summer Comfort Yeşil,1999,https://www.karaca.com/urun/karaca-home-anna-cift-kisilik-summer-comfort-yesil,https://static.karaca.com/catalog/view/assets/images/placeholder-2.jpg
7175626,Karaca Home Sofie Tek Kişilik Pike Yeşil,349.99,https://www.karaca.com/urun/karaca-home-sofie-tek-kisilik-pike-yesil,https://static.karaca.com/catalog/view/assets/images/placeholder-2.jpg
7131895,Karaca Home Mountain Siyah-Beyaz Tek Kişilik Cozy Comfort,1699,https://www.karaca.com/urun/karaca-home-mountain-siyah-beyaz-tek-kisilik-cozy-comfort,https://cdn.karaca.com/rcman/cw250h250q90gm/image/banner/200.21.01.0356-15.jpg
7131023,Karaca Home Alegra Mood Multi %100 Pamuk Çift Kişilik Pike Takımı,799.99,https://www.karaca.com/urun/karaca-home-alegra-mood-multi-100-pamuk-cift-kisilik-pike-takimi,https://cdn.karaca.com/rcman/cw250h250q90gm/image/banner/karaca/urun/urun2/urun3/200.21.01.0095-230.jpg
5479735,Karaca Home Parlin Fuşya %100 Pamuk Çift Kişilik Nevresim Takımı,799.99,https://www.karaca.com/urun/karaca-home-parlin-fusya-rnf-cift-kisilik-nevresim-takimi,https://cdn.karaca.com/rcman/cw250h250q90gm/image/cdndata/1/202105/200.16.01.0001/8680214224656-1322.jpg
7131063,Karaca Home Annata Somon %100 Pamuk Çift Kişilik Pike Takımı,799.99,https://www.karaca.com/urun/karaca-home-annata-somon--100-pamuk-cift-kisilik-pike-takimi,https://cdn.karaca.com/rcman/cw250h250q90gm/image/cdndata/1/202206/200.21.01.0105/8680214300879-305.jpg
7191334,Karaca Home Scarlett 8 Parça Ceyiz Seti Gül Kurusu,2999,https://www.karaca.com/urun/karaca-home-scarlett-8-prc-ceyiz-seti-gul-kurusu,https://cdn.karaca.com/rcman/cw250h250q90gm/image/banner/karaca/urun/urun2/urun3/200.22.05.0182-121.jpg
7130711,Karaca Home Motto Cotton Comfort Çift Kişilik Antrasit Uyku Seti,3499,https://www.karaca.com/urun/karaca-home-motto-antrasit-cift-kisilik-cotton-comfort,https://cdn.karaca.com/rcman/cw250h250q90gm/image/cdndata/1/202206/200.21.01.0006/8680214297728-1.jpg
7176634,Sarah Anderson Melange Çift Kişilik Nevresim Takımı,1299,https://www.karaca.com/urun/sarah-anderson-melange-cift-kisilik-nevresim-takimi,https://cdn.karaca.com/rcman/cw250h250q90gm/image/banner/karaca/urun/urun2/urun3/160.22.11.0041-215.jpg
7176635,Sarah Anderson Melange Tek Kişilik Nevresim Takımı ,1099,https://www.karaca.com/urun/sarah-anderson-melange-tek-kisilik-nevresim-takimi,https://cdn.karaca.com/rcman/cw250h250q90gm/image/cdndata/713/202308/160.22.11.0042/8680214336762-221.jpg
7161863,Karaca Home Roller Çift Kişilik Yatak Örtüsü İndigo,199.99,https://www.karaca.com/urun/karaca-home-roller-cift-kisilik-yatak-ortusu-indigo,https://static.karaca.com/catalog/view/assets/images/placeholder-2.jpg
7175206,Karaca Home Cool Touch Stripe Çift Kişilik Nevresim Takımı Gri,1999,https://www.karaca.com/urun/karaca-home-cool-touch-stripe-cift-kisilik-nevresim-takimi-gri,https://static.karaca.com/catalog/view/assets/images/placeholder-2.jpg
7176683,Karaca Home x 2Wins Love and Dream Çift Kişilik Yatak Örtüsü,3999,https://www.karaca.com/urun/karaca-home-x-2-wins-love-dream-cift-kisilik-yatak-ortusu,https://static.karaca.com/catalog/view/assets/images/placeholder-2.jpg
7192051,Karaca Home x 2Wins Love and Dream Çift Kişilik Nevresim Takımı,3499,https://www.karaca.com/urun/karaca-home-x-2-wins-love-dream-cift-kisilik-nevresim-takimi,https://static.karaca.com/catalog/view/assets/images/placeholder-2.jpg
7130199,Karaca Home Dulce Mavi %100 Pamuk Çift Kişilik Nevresim Takımı,799.99,https://www.karaca.com/urun/karaca-home-dulce-mavi--100-pamuk-cift-kisilik-nevresim-takimi,https://static.karaca.com/catalog/view/assets/images/placeholder-2.jpg
7160464,Karaca Home Barny Çift Kişilik Müslin Summer Comfort İndigo,999.99,https://www.karaca.com/urun/karaca-home-barny-cift-kisilik-summer-comfort-indigo,https://static.karaca.com/catalog/view/assets/images/placeholder-2.jpg
7131055,Karaca Home Amar Mavi %100 Pamuk Çift Kişilik Pike Takımı,799.99,https://www.karaca.com/urun/karaca-home-amar-mavi--100-pamuk-cift-kisilik-pike-takimi,https://static.karaca.com/catalog/view/assets/images/placeholder-2.jpg
7014184,Karaca Home Antro Yeşil %100 Pamuk Çift Kişilik Nevresim Takımı,699.99,https://www.karaca.com/urun/karaca-home-antro-mavi--100-pamuk-cift-kisilik-nevresim-takimi,https://static.karaca.com/catalog/view/assets/images/placeholder-2.jpg
6969513,Karaca Home Bellance Mavi %100 Pamuk Çift Kişilik Nevresim Takımı,799.99,https://www.karaca.com/urun/karaca-home-bellance-mavi--100-pamuk-cift-kisilik-nevresim-takimi,https://static.karaca.com/catalog/view/assets/images/placeholder-2.jpg
7191251,Karaca Home Scarlett 8 Parça Ceyiz Seti Gold,2999,https://www.karaca.com/urun/karaca-home-scarlett-8-parca-ceyiz-seti-gold,https://static.karaca.com/catalog/view/assets/images/placeholder-2.jpg
7186465,Karaca Home Celina Lacivert Çift Kişilik Daily Comfort Set ,2499,https://www.karaca.com/urun/karaca-home-celina-lacivert-cift-kisilik-daily-comfort-set,https://static.karaca.com/catalog/view/assets/images/placeholder-2.jpg
7176624,Sarah Anderson Lionel Çift Kişilik Nevresim Takımı,1299,https://www.karaca.com/urun/sarah-anderson-lionel-cift-kisilik-nevresim-takimi,https://static.karaca.com/catalog/view/assets/images/placeholder-2.jpg
7131155,Karaca Home Joena İndigo Çift Kişilik Battaniye,424.99,https://www.karaca.com/urun/karaca-home-joena-indigo-cift-kisilik-battaniye,https://static.karaca.com/catalog/view/assets/images/placeholder-2.jpg
6230115,Karaca Home Glen %100 Pamuk Çift Kişilik Nevresim Takımı Pembe,799.99,https://www.karaca.com/urun/karaca-home-glen-pembe-pamuk-cift-kisilik-nevresim-takimi,https://static.karaca.com/catalog/view/assets/images/placeholder-2.jpg
7171379,Karaca Home Favora Çift Kişilik Nevresim Takımı Multicolor,699.99,https://www.karaca.com/urun/karaca-home-favora-cift-kisilik-nevresim-takimi-multicolor,https://static.karaca.com/catalog/view/assets/images/placeholder-2.jpg
7175204,Karaca Home Cool Touch Stripe Çift Kişilik Nevresim Takımı Mavi ,1999,https://www.karaca.com/urun/karaca-home-cool-touch-stripe-cift-kisilik-nevresim-takimi-mavi,https://static.karaca.com/catalog/view/assets/images/placeholder-2.jpg
7176631,Sarah Anderson Era Tek Kişilik Nevresim Takımı İndigo,1099,https://www.karaca.com/urun/sarah-anderson-era-tek-kisilik-nevresim-takimi-indigo,https://cdn.karaca.com/rcman/cw250h250q90gm/image/banner/karaca/urun/urun2/urun3/160.22.11.0038-191.jpg
7172811,Karaca Home Colby Gri %100 Pamuk Çift Kişilik Nevresim Takımı ,799.99,https://www.karaca.com/urun/karaca-home-colby-gri-100-pamuk-cift-kisilik-nevresim-takimi,https://cdn.karaca.com/rcman/cw250h250q90gm/image/cdndata/1/202304/200.22.08.0030/8680214328484-121.jpg
7166063,Karaca Home Tugba 8 Parça Private Çeyiz Seti Pudra ,2999,https://www.karaca.com/urun/karaca-home-tugba-8-parca-ceyiz-seti-pudra,https://cdn.karaca.com/rcman/cw250h250q90gm/image/cdndata/1/202212/200.22.11.0042/8680214322970-1.jpg
7172805,Karaca Home Cornell %100 Pamuk Çift Kişilik Nevresim Takımı Koyu Pembe PP,799.99,https://www.karaca.com/urun/karaca-home-cornell--100-pamuk-cift-kisilik-nevresim-takimi-koyu-pembe-pp,https://cdn.karaca.com/rcman/cw250h250q90gm/image/cdndata/1/202304/200.22.08.0022/8680214328392-12.jpg
7186464,Karaca Home Celina Hardal Çift Kişilik Comfort Set,2499,https://www.karaca.com/urun/karaca-home-celina-hardal-cift-kisilik-comfort-set,https://cdn.karaca.com/rcman/cw250h250q90gm/image/banner/karaca/urun/urun2/urun3/200.22.05.0083-111.jpg
7176625,Sarah Anderson Carlene Çift Kişilik Nevresim Takımı Sarı,1299,https://www.karaca.com/urun/sarah-anderson-carlene-cift-kisilik-nevresim-takimi-sari,https://cdn.karaca.com/rcman/cw250h250q90gm/image/cdndata/713/202308/160.22.11.0032/8680214334089-141.jpg
7155700,Karaca Home Pandora Bakır 8 Parça Çeyiz Seti ,3999,https://www.karaca.com/urun/karaca-home-pandora-bakir-8-parca-ceyiz-seti,https://cdn.karaca.com/rcman/cw250h250q90gm/image/cdndata/1/202210/200.21.01.0936/8680214317082-1.jpg
7173329,Karaca Home Jody Çift Kişilik Pike Takımı Sarı,849.99,https://www.karaca.com/urun/karaca-home-jody-cift-kisilik-pike-takimi-sari,https://cdn.karaca.com/rcman/cw250h250q90gm/image/cdndata/1/202304/200.22.14.0145/8680214322581-123.jpg
7131891,Karaca Home Mountain Kırmızı-Siyah Tek Kişilik Cozy Comfort,1699,https://www.karaca.com/urun/karaca-home-mountain-kirmizi-siyah-tek-kisilik-cozy-comfort,https://static.karaca.com/catalog/view/assets/images/placeholder-2.jpg
7176626,Sarah Anderson Lionel Tek Kişilik Nevresim Takımı,1099,https://www.karaca.com/urun/sarah-anderson-lionel-tek-kisilik-nevresim-takimi,https://static.karaca.com/catalog/view/assets/images/placeholder-2.jpg
7176632,Sarah Anderson Brenna Çift Kişilik Nevresim Takımı,1299,https://www.karaca.com/urun/sarah-anderson-brenna-cift-kisilik-nevresim-takimi,https://static.karaca.com/catalog/view/assets/images/placeholder-2.jpg
7143716,Karaca Home Wilma Gri Koltuk Örtüsü 170x210 cm,299.99,https://www.karaca.com/urun/karaca-home-wilma-gri-koltuk-ortusu-170x210-cm,https://static.karaca.com/catalog/view/assets/images/placeholder-2.jpg
7159948,Karaca Home Denis %100 Pamuk Saten Çift Kişilik Nevresim Takımı Pudra ,899.99,https://www.karaca.com/urun/karaca-home-denis--100-pamuk-saten-cift-kisilik-nevresim-takimi-pudra,https://static.karaca.com/catalog/view/assets/images/placeholder-2.jpg
6733806,Peanuts by Karaca Home Snoopy Playtime Nakışlı 4-6 Yaş Çocuk Bornoz Seti,349.99,https://www.karaca.com/urun/karaca-home-peanuts-playtime-nakisli-4-6-yas-cocuk-bornoz-seti,https://static.karaca.com/catalog/view/assets/images/placeholder-2.jpg
7163375,Karaca Home Microfiber Winter Çift Kişilik Yorgan 195x215/300 cm,599.99,https://www.karaca.com/urun/karaca-home-microfiber-winter-cift-kisilik-yorgan-195x215300-cm,https://static.karaca.com/catalog/view/assets/images/placeholder-2.jpg
7173773,Karaca Home Narle Çift Kişilik Winter Set Terracotta,3499,https://www.karaca.com/urun/karaca-home-narle-cift-kisilik-winter-set-terracotta,https://static.karaca.com/catalog/view/assets/images/placeholder-2.jpg
7173771,Karaca Home Loretta Çift Kişilik Yatak Örtüsü Bej ,2199,https://www.karaca.com/urun/karaca-home-loretta-cift-kisilik-yatak-ortusu-bej,https://static.karaca.com/catalog/view/assets/images/placeholder-2.jpg
7131463,Karaca Home Siyah-Beyaz Ekose Tüylü Kırlent 45 cm x 45 cm,149.99,https://www.karaca.com/urun/karaca-home-siyah-beyaz-ekose-tuylu-kirlent-45-cm-x-45-cm,https://cdn.karaca.com/rcman/cw250h250q90gm/image/cdndata/1/202206/200.21.01.0220/8680214302743-5.jpg
7138763,Karaca Home Valeria Best Antrasit 8 Parça Antrasit Çeyiz Seti,3499,https://www.karaca.com/urun/karaca-home-valeria-best-antrasit-8-parca-antrasit-ceyiz-seti,https://cdn.karaca.com/rcman/cw250h250q90gm/image/cdndata/1/202208/200.21.01.0575/8680214307663-1.jpg
7171378,Karaca Home Semblance Çift Kişilik Nevresim Takımı Multicolor,599.99,https://www.karaca.com/urun/karaca-home-semblance-cift-kisilik-nevresim-takimi-multicolor,https://static.karaca.com/catalog/view/assets/images/placeholder-2.jpg
7131687,Karaca Home Narlo Fuşya Çift Kişilik Winter Set,2499,https://www.karaca.com/urun/karaca-home-narlo-indigo-cift-kisilik-winter-set,https://static.karaca.com/catalog/view/assets/images/placeholder-2.jpg
7012376,Karaca Home Back To Basic Açık Hardal  %100 Pamuk Tek Kişilik Nevresim Takımı,1799,https://www.karaca.com/urun/karaca-home-back-to-basic-acik-hardal-tek-kisilik-nevresim-takimi,https://static.karaca.com/catalog/view/assets/images/placeholder-2.jpg
7144444,Karaca Home Young Wild Friends Panduf 32-33,179.99,https://www.karaca.com/urun/karaca-home-young-wild-friends-panduf-32-33,https://static.karaca.com/catalog/view/assets/images/placeholder-2.jpg
7144448,Karaca Home Young Wild Friends Panduf 34-35,179.99,https://www.karaca.com/urun/karaca-home-young-wild-friends-panduf-34-35,https://static.karaca.com/catalog/view/assets/images/placeholder-2.jpg
7157660,Karaca Home Tahara Tek Kişilik Nevresim Takımı Terracota,1199,https://www.karaca.com/urun/karaca-home-tahara-tek-kisilik-nevresim-takimi-terracota,https://cdn.karaca.com/rcman/cw250h250q90gm/image/cdndata/1/202210/200.22.01.0155/8680214319000-1.jpg
7175767,Karaca Home Milo Volanlı 2'li Yastık Kılıfı,212.49,https://www.karaca.com/urun/karaca-home-milo-volanli-2li-yastik-kilifi,https://cdn.karaca.com/rcman/cw250h250q90gm/image/banner/karaca/urun/urun2/urun3/200.22.08.0040-11.jpg
7147448,Karaca Home Flow Çizgili Çift Kişilik Waffle Pike 200x230 cm İndigo,199.99,https://www.karaca.com/urun/karaca-home-flow-cizgili-cift-kisilik-waffle-pike-200x230-cm-indigo,https://cdn.karaca.com/rcman/cw250h250q90gm/image/cdndata/1/202209/200.21.01.0767/8680214313152-592.jpg
7172563,Nautica Home Rope Navy Çift Kişilik Yatak Örtüsü Seti,1399,https://www.karaca.com/urun/nautica-rope-navy-cift-kisilik-yatak-ortusu-seti,https://cdn.karaca.com/rcman/cw250h250q90gm/image/cdndata/803/202303/180.01.01.1391/8682991012570-123.jpg
7024052,Karaca Home Serena Mavi %100 Pamuk Çift Kişilik Complete Takım,999.99,https://www.karaca.com/urun/karaca-home-serena-mavi--100-pamuk-cift-kisilik-complete-takim,https://cdn.karaca.com/rcman/cw250h250q90gm/image/cdndata/1/202201/200.20.01.0331/8680214290545-1.jpg
7173162,Nautica Home Morgan %100 Pamuk Tek Kişilik Nevresim Takımı ,799.99,https://www.karaca.com/urun/nautica-home-morgan--100-pamuk-tek-kisilik-nevresim-takimi,https://cdn.karaca.com/rcman/cw250h250q90gm/image/cdndata/803/202304/180.01.01.1322/8682991011870-200.jpg
7172756,Nautica Home Ocean %100 Pamuk Çift Kişilik Nevresim Takımı Blue,899.99,https://www.karaca.com/urun/nautica-home-ocean--100-pamuk-cift-kisilik-nevresim-takimi-blue,https://cdn.karaca.com/rcman/cw250h250q90gm/image/cdndata/803/202304/180.01.01.1319/8682991011849-14.jpg
7130847,Karaca Home Cedric Multi Çift Kişilik Nakışlı Nevresim Takımı,799.99,https://www.karaca.com/urun/karaca-home-cedric-multi-cift-kisilik-nakisli-nevresim-takimi,https://cdn.karaca.com/rcman/cw250h250q90gm/image/cdndata/1/202206/200.21.01.0042/8680214300244-2.jpg
7138699,Karaca Home Arlo Terracotta Çift Kişilik İpliği Boyalı Nevresim Takımı,1299,https://www.karaca.com/urun/karaca-home-arlo-terracotta-cift-kisilik-ipligi-boyali-nevresim-takimi,https://static.karaca.com/catalog/view/assets/images/placeholder-2.jpg
7085600,Karaca Home Alfia Pudra %100 Pamuk Çift Kişilik Nevresim Takımı,799.99,https://www.karaca.com/urun/karaca-home-alfia-pudra--100-pamuk-cift-kisilik-nevresim-takimi,https://static.karaca.com/catalog/view/assets/images/placeholder-2.jpg
7173785,Karaca Home Maris %100 Pamuk Çift Kişilik Saten Nevresim Takımı Mürdüm,1799,https://www.karaca.com/urun/karaca-home-maris-indigo-100-pamuk-cift-kisilik-saten-nevresim-takimi,https://static.karaca.com/catalog/view/assets/images/placeholder-2.jpg
6703766,Karaca Home 4 Element Bej %100 Pamuk Çift Kişilik Nevresim Takımı Toprak,1999,https://www.karaca.com/urun/karaca-home-4-element-bej-cift-kisilik-nevresim-takimi-toprak,https://static.karaca.com/catalog/view/assets/images/placeholder-2.jpg
6187640,Karaca Home Back To Basic Beyaz %100 Pamuk Çift Kişilik Nevresim Takımı,1999,https://www.karaca.com/urun/karaca-home-back-to-basic-beyaz-cift-kisilik-nevresim-takimi,https://static.karaca.com/catalog/view/assets/images/placeholder-2.jpg
7172803,Karaca Home Conrad %100 Pamuk Çift Kişilik Nevresim Takımı Yeşil (PP),799.99,https://www.karaca.com/urun/karaca-home-conrad--100-pamuk-cift-kisilik-nevresim-takimi-yesil--pp-,https://static.karaca.com/catalog/view/assets/images/placeholder-2.jpg
6187723,Karaca Home Back To Basic Bej %100 Pamuk Tek Kişilik Nevresim Takımı,1799,https://www.karaca.com/urun/karaca-home-back-to-basic-bej-tek-kisilik-nevresim-takimi,https://static.karaca.com/catalog/view/assets/images/placeholder-2.jpg
6187784,Karaca Home Back To Basic Mavi %100 Pamuk Tek Kişilik Nevresim Takımı,1799,https://www.karaca.com/urun/karaca-home-back-to-basic-mavi-tek-kisilik-nevresim-takimi,https://static.karaca.com/catalog/view/assets/images/placeholder-2.jpg
7160124,Karaca Home Casey Çift Kişilik Waffle Pike 200x230 cm Yeşil ,599.99,https://www.karaca.com/urun/karaca-home-casey-cift-kisilik-waffle-pike-200x230-cm-yesil,https://static.karaca.com/catalog/view/assets/images/placeholder-2.jpg
7145920,Karaca Home Cordoba Tek Kişilik Pike Yatak Örtüsü 160x230 cm Kiremit,449.99,https://www.karaca.com/urun/karaca-home-cordoba-tek-kisilik-pike-160x230-cm-kiremit,https://static.karaca.com/catalog/view/assets/images/placeholder-2.jpg
7172810,Karaca Home Addie %100 Pamuk Çift Kişilik Nevresim Takımı Sarı (PP),679.99,https://www.karaca.com/urun/karaca-home-addie-100-pamuk-cift-ks-nevresim-takimi-sari--pp-,https://static.karaca.com/catalog/view/assets/images/placeholder-2.jpg
7172849,Karaca Home Young Youthful %100 Pamuk Fitted Tek Kişilik Nevresim Takımı,799.99,https://www.karaca.com/urun/karaca-home-young-youthful--100-pamuk-fitted-tek-kisilik-nevresim-takimi,https://static.karaca.com/catalog/view/assets/images/placeholder-2.jpg
7172846,Karaca Home Young Barton %100 Pamuk Tek Kişilik Nevresim Takımı Fitted ,799.99,https://www.karaca.com/urun/karaca-home-young-barton-100-pamuk-tek-kisilik-nevresim-takimi-fitted,https://static.karaca.com/catalog/view/assets/images/placeholder-2.jpg
7172772,Karaca Home Harry Potter By Draco Çift Kişilik Nevresim Takımı,1299,https://www.karaca.com/urun/harry-potter-by-karaca-home-draco-cift-kisilik-nevresim-takimi,https://static.karaca.com/catalog/view/assets/images/placeholder-2.jpg
7145904,Karaca Home 4 Element  Ateş Çift Kişilik Triko Battaniye Koyu Kahverengi,899.99,https://www.karaca.com/urun/karaca-home-4-element-ates-cift-kisilik-triko-battaniye-koyu-kahverengi,https://static.karaca.com/catalog/view/assets/images/placeholder-2.jpg
7145016,Karaca Home Uniq %100 Pamuk Tek Kişilik Saten Nevresim Takımı Haki,1299,https://www.karaca.com/urun/karaca-home-uniq-100-pamuk-tek-kisilik-saten-nevresim-takimi-haki,https://static.karaca.com/catalog/view/assets/images/placeholder-2.jpg
7172848,Karaca Home Young Animal %100 Pamuk Tek Kişilik Fitted Nevresim Takımı,799.99,https://www.karaca.com/urun/karaca-home-young-animal--100-pamuk-tek-kisilik-fitted-nevresim-takimi,https://cdn.karaca.com/rcman/cw250h250q90gm/image/cdndata/1/202304/200.22.14.0230/8680214324301-13.jpg
7172773,Karaca Home Harry Potter By Draco Tek Kişilik Nevresim Takımı ,999.99,https://www.karaca.com/urun/harry-potter-by-karaca-home-draco-tek-kisilik-nevresim-takimi,https://cdn.karaca.com/rcman/cw250h250q90gm/image/cdndata/811/202304/203.08.01.0007/8682991013607-1.jpg
7160476,Karaca Home Barny Tek Kişilik Müslin Summer Comfort Kırmızı,899.99,https://www.karaca.com/urun/karaca-home-barny-tek-kisilik-summer-comfort-kirmizi,https://cdn.karaca.com/rcman/cw250h250q90gm/image/cdndata/1/202211/200.22.04.0032/8680214319758-123.jpg
7160228,Karaca Home  Tiles Çift Kişilik Yatak Örtüsü Mavi ,899.99,https://www.karaca.com/urun/karaca-home-tiles-cift-kisilik-yatak-ortusu-mavi,https://cdn.karaca.com/rcman/cw250h250q90gm/image/cdndata/1/202211/200.22.04.0013/8680214319512-12.jpg
7172776,Karaca Home Harry Potter Owl Çift Kişilik Çarşaf Takımı,599.99,https://www.karaca.com/urun/karaca-home-harry-potter-owl-cift-kisilik-carsaf-takimi,https://cdn.karaca.com/rcman/cw250h250q90gm/image/cdndata/811/202304/203.08.01.0014/8682991013744-291.jpg
7145040,Karaca Home Uniq %100 Pamuk Tek Kişilik Saten Nevresim Takımı Siyah,1299,https://www.karaca.com/urun/karaca-home-uniq-100-pamuk-tek-kisilik-saten-nevresim-takimi-siyah,https://cdn.karaca.com/rcman/cw250h250q90gm/image/cdndata/1/202209/200.21.01.0751/8680214312315-333.jpg
7172847,Karaca Home Young Skateboard  %100 Pamuk Tek Kişilik Nevresim Takımı Fitted ,799.99,https://www.karaca.com/urun/karaca-home-young-skateboard-100-pamuk-tek-kisilik-nevresim-takimi-fitted,https://cdn.karaca.com/rcman/cw250h250q90gm/image/cdndata/1/202304/200.22.14.0229/8680214324295-182.jpg
7173332,Karaca Home Navy Pamuk Tek Kişilik Pike Takımı İndigo,899.99,https://www.karaca.com/urun/karaca-home-navy-pamuk-tek-kisilik-pike-takimi-indigo,https://cdn.karaca.com/rcman/cw250h250q90gm/image/cdndata/1/202304/200.22.14.0151/8680214322666-348.jpg
